{
  "id": 10,
  "title": "Level 10",
  "type": "visual_equation",
  "prompt": "If \u25b3 + \u25b3 = 10 and \u25b3 + \u25a1 = 14, what is \u25a1?",
  "assets": {
    "image": null,
    "layout": "symbols"
  },
  "input": {
    "mode": "numeric",
    "min": 0,
    "max": 999
  },
  "answer": 9,
  "hint": "Find the triangle value first.",
  "explanation": "\u25b3 = 5, so \u25a1 = 9.",
  "difficulty": "easy",
  "tags": [
    "visual_equation",
    "easy"
  ]
}
