{
  "id": 72,
  "title": "Level 72",
  "type": "operator_pattern",
  "prompt": "4 + 5 = 9, 5 + 6 = 36, 6 + 7 = ?",
  "assets": {
    "image": null,
    "layout": "equation"
  },
  "input": {
    "mode": "numeric",
    "min": 0,
    "max": 999
  },
  "answer": 10,
  "hint": "Try a pattern beyond simple addition.",
  "explanation": "The answer for this level is 10 (pattern step 72).",
  "difficulty": "hard",
  "tags": [
    "operator_pattern",
    "hard"
  ]
}
