{
  "id": 13,
  "title": "Level 13",
  "type": "missing_term",
  "prompt": "8, 9, 11, 14, 18, ?",
  "assets": {
    "image": null,
    "layout": "sequence"
  },
  "input": {
    "mode": "numeric",
    "min": 0,
    "max": 999
  },
  "answer": 23,
  "hint": "Each term may depend on previous terms.",
  "explanation": "The next term is 23.",
  "difficulty": "easy",
  "tags": [
    "missing_term",
    "easy"
  ]
}
